{
  "coefficients": [
    {
      "csd": "0.00000+0-0+000+",
      "index": 0,
      "value": 0.01275634765625
    },
    {
      "csd": "0.0000+0-0-000-",
      "index": 1,
      "value": 0.0213623046875
    },
    {
      "csd": "0.0000+0+0-000+",
      "index": 2,
      "value": 0.0372314453125
    },
    {
      "csd": "0.000+00-0+0+",
      "index": 3,
      "value": 0.05712890625
    },
    {
      "csd": "0.000+0+00+0-",
      "index": 4,
      "value": 0.07958984375
    },
    {
      "csd": "0.00+0-0+000+",
      "index": 5,
      "value": 0.10205078125
    },
    {
      "csd": "0.00+0000-000+00+",
      "index": 6,
      "value": 0.121368408203125
    },
    {
      "csd": "0.00+000+0+00+",
      "index": 7,
      "value": 0.135009765625
    },
    {
      "csd": "0.00+00+000000-00+",
      "index": 8,
      "value": 0.1405181884765625
    },
    {
      "csd": "0.00+00+0-0-",
      "index": 9,
      "value": 0.1357421875
    },
    {
      "csd": "0.00+0000-0-0+",
      "index": 10,
      "value": 0.120361328125
    },
    {
      "csd": "0.00+0-000+00+",
      "index": 11,
      "value": 0.095947265625
    },
    {
      "csd": "0.000+000+0-0-",
      "index": 12,
      "value": 0.065185546875
    },
    {
      "csd": "0.0000+00000+0+0-",
      "index": 13,
      "value": 0.031829833984375
    },
    {
      "csd": "0.0000000000+0-0000000+000-",
      "index": 14,
      "value": 0.00036665797233581543
    },
    {
      "csd": "0.0000-00+0+0000-",
      "index": 15,
      "value": -0.026397705078125
    },
    {
      "csd": "0.000-0+00+00000-",
      "index": 16,
      "value": -0.044952392578125
    },
    {
      "csd": "0.000-00+00+000+",
      "index": 17,
      "value": -0.05364990234375
    },
    {
      "csd": "0.000-00+0+000000+",
      "index": 18,
      "value": -0.0527191162109375
    },
    {
      "csd": "0.000-0+0+0-",
      "index": 19,
      "value": -0.0439453125
    },
    {
      "csd": "0.0000-000+0-0+",
      "index": 20,
      "value": -0.0296630859375
    },
    {
      "csd": "0.00000-0+0-0-",
      "index": 21,
      "value": -0.012939453125
    },
    {
      "csd": "0.0000000+00-00-0+",
      "index": 22,
      "value": 0.0033721923828125
    },
    {
      "csd": "0.00000+00+0-0000+",
      "index": 23,
      "value": 0.0171051025390625
    },
    {
      "csd": "0.0000+0-0+0+",
      "index": 24,
      "value": 0.02587890625
    },
    {
      "csd": "0.0000+0000-0-0000-",
      "index": 25,
      "value": 0.03002166748046875
    },
    {
      "csd": "0.0000+000-000-00000000-",
      "index": 26,
      "value": 0.0291745662689209
    },
    {
      "csd": "0.0000+0-0+000+",
      "index": 27,
      "value": 0.0255126953125
    },
    {
      "csd": "0.00000+0+000+0+",
      "index": 28,
      "value": 0.01983642578125
    },
    {
      "csd": "0.00000+00-0000+00-",
      "index": 29,
      "value": 0.01372528076171875
    },
    {
      "csd": "0.000000+000000+000-0000+",
      "index": 30,
      "value": 0.007869839668273926
    },
    {
      "csd": "0.0000000+000-00+0+",
      "index": 31,
      "value": 0.00370025634765625
    }
  ],
  "csd_nnz": 4,
  "filter_order": 32,
  "iterations": 1350,
  "spectral_method": "fft",
  "verilog": "\nmodule fir_filter_direct (\n    input signed [15:0] x,      // Input value\n    output signed [41:0] h0\n    output signed [41:0] h1\n    output signed [41:0] h2\n    output signed [41:0] h3\n    output signed [41:0] h4\n    output signed [41:0] h5\n    output signed [41:0] h6\n    output signed [41:0] h7\n    output signed [41:0] h8\n    output signed [41:0] h9\n    output signed [41:0] h10\n    output signed [41:0] h11\n    output signed [41:0] h12\n    output signed [41:0] h13\n    output signed [41:0] h14\n    output signed [41:0] h15\n    output signed [41:0] h16\n    output signed [41:0] h17\n    output signed [41:0] h18\n    output signed [41:0] h19\n    output signed [41:0] h20\n    output signed [41:0] h21\n    output signed [41:0] h22\n    output signed [41:0] h23\n    output signed [41:0] h24\n    output signed [41:0] h25\n    output signed [41:0] h26\n    output signed [41:0] h27\n    output signed [41:0] h28\n    output signed [41:0] h29\n    output signed [41:0] h30\n    output signed [41:0] h31\n);\n\n    // Create shifted versions of input\n    wire signed [41:0] x_shift17 = x <<< 17;\n    wire signed [41:0] x_shift16 = x <<< 16;\n    wire signed [41:0] x_shift14 = x <<< 14;\n    wire signed [41:0] x_shift13 = x <<< 13;\n    wire signed [41:0] x_shift12 = x <<< 12;\n    wire signed [41:0] x_shift11 = x <<< 11;\n    wire signed [41:0] x_shift10 = x <<< 10;\n    wire signed [41:0] x_shift9 = x <<< 9;\n    wire signed [41:0] x_shift8 = x <<< 8;\n    wire signed [41:0] x_shift7 = x <<< 7;\n    wire signed [41:0] x_shift6 = x <<< 6;\n    wire signed [41:0] x_shift5 = x <<< 5;\n    wire signed [41:0] x_shift4 = x <<< 4;\n    wire signed [41:0] x_shift3 = x <<< 3;\n    wire signed [41:0] x_shift2 = x <<< 2;\n    wire signed [41:0] x_shift0 = x <<< 0;\n\n    // Cross-CSE: shared pattern \"+0-\"\n    wire signed [41:0] _cse_0 = x_shift14 - x_shift12;\n\n    // h0: 000000000000000000+0-0+000+\n    wire signed [41:0] h0 = (_cse_0 >>> 6) + x_shift4 + x_shift0;\n\n    // h1: 000000000000000000+0-0-000-\n    wire signed [41:0] h1 = (_cse_0 >>> 6) + -x_shift4 - x_shift0;\n\n    // h2: 000000000000000000+0+0-000+\n    wire signed [41:0] h2 = x_shift8 + (_cse_0 >>> 8) + x_shift0;\n\n    // h3: 0000000000000000000+00-0+0+\n    wire signed [41:0] h3 = x_shift7 - x_shift4 + x_shift2 + x_shift0;\n\n    // h4: 0000000000000000000+0+00+0-\n    wire signed [41:0] h4 = x_shift7 + x_shift5 + (_cse_0 >>> 12);\n\n    // h5: 000000000000000000+0-0+000+\n    wire signed [41:0] h5 = (_cse_0 >>> 6) + x_shift4 + x_shift0;\n\n    // h6: 00000000000000+0000-000+00+\n    wire signed [41:0] h6 = x_shift12 - x_shift7 + x_shift3 + x_shift0;\n\n    // h7: 00000000000000000+000+0+00+\n    wire signed [41:0] h7 = x_shift9 + x_shift5 + x_shift3 + x_shift0;\n\n    // h8: 0000000000000+00+000000-00+\n    wire signed [41:0] h8 = x_shift13 + x_shift10 - x_shift3 + x_shift0;\n\n    // h9: 0000000000000000000+00+0-0-\n    wire signed [41:0] h9 = x_shift7 + (_cse_0 >>> 10) + -x_shift0;\n\n    // h10: 00000000000000000+0000-0-0+\n    wire signed [41:0] h10 = x_shift9 - x_shift4 - x_shift2 + x_shift0;\n\n    // h11: 00000000000000000+0-000+00+\n    wire signed [41:0] h11 = (_cse_0 >>> 5) + x_shift3 + x_shift0;\n\n    // h12: 000000000000000000+000+0-0-\n    wire signed [41:0] h12 = x_shift8 + (_cse_0 >>> 10) + -x_shift0;\n\n    // h13: 0000000000000000+00000+0+0-\n    wire signed [41:0] h13 = x_shift10 + x_shift4 + (_cse_0 >>> 12);\n\n    // h14: 000000000000+0-0000000+000-\n    wire signed [41:0] h14 = _cse_0 + x_shift4 - x_shift0;\n\n    // h15: 0000000000000000-00+0+0000-\n    wire signed [41:0] h15 = -x_shift10 + x_shift7 + x_shift5 - x_shift0;\n\n    // h16: 000000000000000-0+00+00000-\n    wire signed [41:0] h16 = -x_shift11 + x_shift9 + x_shift6 - x_shift0;\n\n    // h17: 0000000000000000-00+00+000+\n    wire signed [41:0] h17 = -x_shift10 + x_shift7 + x_shift4 + x_shift0;\n\n    // h18: 00000000000000-00+0+000000+\n    wire signed [41:0] h18 = -x_shift12 + x_shift9 + x_shift7 + x_shift0;\n\n    // h19: 00000000000000000000-0+0+0-\n    wire signed [41:0] h19 = -x_shift6 + x_shift4 + (_cse_0 >>> 12);\n\n    // h20: 000000000000000000-000+0-0+\n    wire signed [41:0] h20 = -x_shift8 + (_cse_0 >>> 10) + x_shift0;\n\n    // h21: 00000000000000000000-0+0-0-\n    wire signed [41:0] h21 = -x_shift6 + (_cse_0 >>> 10) + -x_shift0;\n\n    // h22: 000000000000000000+00-00-0+\n    wire signed [41:0] h22 = x_shift8 - x_shift5 - x_shift2 + x_shift0;\n\n    // h23: 0000000000000000+00+0-0000+\n    wire signed [41:0] h23 = x_shift10 + (_cse_0 >>> 7) + x_shift0;\n\n    // h24: 00000000000000000000+0-0+0+\n    wire signed [41:0] h24 = (_cse_0 >>> 8) + x_shift2 + x_shift0;\n\n    // h25: 00000000000000+0000-0-0000-\n    wire signed [41:0] h25 = x_shift12 - x_shift7 - x_shift5 - x_shift0;\n\n    // h26: 000000000+000-000-00000000-\n    wire signed [41:0] h26 = x_shift17 - x_shift13 - x_shift9 - x_shift0;\n\n    // h27: 000000000000000000+0-0+000+\n    wire signed [41:0] h27 = (_cse_0 >>> 6) + x_shift4 + x_shift0;\n\n    // h28: 000000000000000000+0+000+0+\n    wire signed [41:0] h28 = x_shift8 + x_shift6 + x_shift2 + x_shift0;\n\n    // h29: 000000000000000+00-0000+00-\n    wire signed [41:0] h29 = x_shift11 - x_shift8 + x_shift3 - x_shift0;\n\n    // h30: 0000000000+000000+000-0000+\n    wire signed [41:0] h30 = x_shift16 + x_shift9 - x_shift5 + x_shift0;\n\n    // h31: 00000000000000000+000-00+0+\n    wire signed [41:0] h31 = x_shift9 - x_shift5 + x_shift2 + x_shift0;\nendmodule\n"
}