{
  "filter_order": 32,
  "csd_nnz": 4,
  "iterations": 1482,
  "coefficients": [
    {
      "index": 0,
      "value": 0.00872363136956475,
      "csd": "0.000000+00+000-000-"
    },
    {
      "index": 1,
      "value": 0.01678798257287681,
      "csd": "0.00000+000+0+0-"
    },
    {
      "index": 2,
      "value": 0.030478994042977194,
      "csd": "0.0000+0000-0+00-"
    },
    {
      "index": 3,
      "value": 0.04817059831902274,
      "csd": "0.000+0-000+0+"
    },
    {
      "index": 4,
      "value": 0.06918093111070675,
      "csd": "0.000+00+00-00-"
    },
    {
      "index": 5,
      "value": 0.09113961980298421,
      "csd": "0.00+0-00-0+"
    },
    {
      "index": 6,
      "value": 0.11187143357757637,
      "csd": "0.00+00-00+0+"
    },
    {
      "index": 7,
      "value": 0.12805932953479904,
      "csd": "0.00+0000+0-00+"
    },
    {
      "index": 8,
      "value": 0.137099412465544,
      "csd": "0.00+00+0-00+"
    },
    {
      "index": 9,
      "value": 0.13679029590803427,
      "csd": "0.00+00+0-00000+"
    },
    {
      "index": 10,
      "value": 0.12621632675332786,
      "csd": "0.00+000000+0+00000-"
    },
    {
      "index": 11,
      "value": 0.10600498040692789,
      "csd": "0.00+00-0-00+"
    },
    {
      "index": 12,
      "value": 0.07789970526264849,
      "csd": "0.000+0+00000-000+"
    },
    {
      "index": 13,
      "value": 0.04537018208721909,
      "csd": "0.000+0-00-0+"
    },
    {
      "index": 14,
      "value": 0.012457961292287946,
      "csd": "0.00000+0-0+0-"
    },
    {
      "index": 15,
      "value": -0.017375411184527054,
      "csd": "0.00000-00-00+0-"
    },
    {
      "index": 16,
      "value": -0.04010324515418054,
      "csd": "0.0000-0-00-000-"
    },
    {
      "index": 17,
      "value": -0.05412878594455221,
      "csd": "0.000-00+000+00+"
    },
    {
      "index": 18,
      "value": -0.05809660232609253,
      "csd": "0.000-000+00+00000+"
    },
    {
      "index": 19,
      "value": -0.05304073474775647,
      "csd": "0.000-00+0+00-"
    },
    {
      "index": 20,
      "value": -0.040958908947203596,
      "csd": "0.0000-0-0-0000+"
    },
    {
      "index": 21,
      "value": -0.024940695030374167,
      "csd": "0.0000-0+0-0+"
    },
    {
      "index": 22,
      "value": -0.00758828450107335,
      "csd": "0.000000-0000+000-0-"
    },
    {
      "index": 23,
      "value": 0.007790103720323217,
      "csd": "0.000000+0000000-0+000+"
    },
    {
      "index": 24,
      "value": 0.01963627496187839,
      "csd": "0.00000+0+0000+00-"
    },
    {
      "index": 25,
      "value": 0.026465378676629736,
      "csd": "0.0000+00-0-00+"
    },
    {
      "index": 26,
      "value": 0.028460823377553207,
      "csd": "0.0000+00-0+00+"
    },
    {
      "index": 27,
      "value": 0.02656562380547263,
      "csd": "0.0000+00-0-0+"
    },
    {
      "index": 28,
      "value": 0.021860047922858714,
      "csd": "0.0000+0-0-0+"
    },
    {
      "index": 29,
      "value": 0.015920671854139916,
      "csd": "0.00000+00000+0+00-"
    },
    {
      "index": 30,
      "value": 0.01011800666516151,
      "csd": "0.000000+0+0+0-"
    },
    {
      "index": 31,
      "value": 0.006424240040557687,
      "csd": "0.000000+0-0+00+"
    }
  ],
  "verilog": "\nmodule fir_filter (\n    input signed [15:0] x,      // Input value\n    output signed [37:0] h0\n    output signed [37:0] h1\n    output signed [37:0] h2\n    output signed [37:0] h3\n    output signed [37:0] h4\n    output signed [37:0] h5\n    output signed [37:0] h6\n    output signed [37:0] h7\n    output signed [37:0] h8\n    output signed [37:0] h9\n    output signed [37:0] h10\n    output signed [37:0] h11\n    output signed [37:0] h12\n    output signed [37:0] h13\n    output signed [37:0] h14\n    output signed [37:0] h15\n    output signed [37:0] h16\n    output signed [37:0] h17\n    output signed [37:0] h18\n    output signed [37:0] h19\n    output signed [37:0] h20\n    output signed [37:0] h21\n    output signed [37:0] h22\n    output signed [37:0] h23\n    output signed [37:0] h24\n    output signed [37:0] h25\n    output signed [37:0] h26\n    output signed [37:0] h27\n    output signed [37:0] h28\n    output signed [37:0] h29\n    output signed [37:0] h30\n    output signed [37:0] h31\n);\n\n    // Create shifted versions of input\n    wire signed [37:0] x_shift15 = x <<< 15;\n    wire signed [37:0] x_shift14 = x <<< 14;\n    wire signed [37:0] x_shift13 = x <<< 13;\n    wire signed [37:0] x_shift12 = x <<< 12;\n    wire signed [37:0] x_shift11 = x <<< 11;\n    wire signed [37:0] x_shift10 = x <<< 10;\n    wire signed [37:0] x_shift9 = x <<< 9;\n    wire signed [37:0] x_shift8 = x <<< 8;\n    wire signed [37:0] x_shift7 = x <<< 7;\n    wire signed [37:0] x_shift6 = x <<< 6;\n    wire signed [37:0] x_shift5 = x <<< 5;\n    wire signed [37:0] x_shift4 = x <<< 4;\n    wire signed [37:0] x_shift3 = x <<< 3;\n    wire signed [37:0] x_shift2 = x <<< 2;\n    wire signed [37:0] x_shift0 = x <<< 0;\n\n    // Cross-CSE: shared pattern \"0+0-\"\n    wire signed [37:0] _cse_0 = x_shift8 - x_shift6;\n\n    // h0: 00000000000+00+000-000-\n    wire signed [37:0] h0 = x_shift11 + x_shift8 - x_shift4 - x_shift0;\n\n    // h1: 00000000000000+000+0+0-\n    wire signed [37:0] h1 = x_shift8 + x_shift4 + (_cse_0 >>> 6);\n\n    // h2: 000000000000+0000-0+00-\n    wire signed [37:0] h2 = x_shift10 - x_shift5 + x_shift3 - x_shift0;\n\n    // h3: 00000000000000+0-000+0+\n    wire signed [37:0] h3 = _cse_0 + x_shift2 + x_shift0;\n\n    // h4: 0000000000000+00+00-00-\n    wire signed [37:0] h4 = x_shift9 + x_shift6 - x_shift3 - x_shift0;\n\n    // h5: 000000000000000+0-00-0+\n    wire signed [37:0] h5 = (_cse_0 >>> 1) + -x_shift2 + x_shift0;\n\n    // h6: 00000000000000+00-00+0+\n    wire signed [37:0] h6 = x_shift8 - x_shift5 + x_shift2 + x_shift0;\n\n    // h7: 000000000000+0000+0-00+\n    wire signed [37:0] h7 = x_shift10 + (_cse_0 >>> 3) + x_shift0;\n\n    // h8: 00000000000000+00+0-00+\n    wire signed [37:0] h8 = x_shift8 + (_cse_0 >>> 3) + x_shift0;\n\n    // h9: 00000000000+00+0-00000+\n    wire signed [37:0] h9 = x_shift11 + _cse_0 + x_shift0;\n\n    // h10: 0000000+000000+0+00000-\n    wire signed [37:0] h10 = x_shift15 + x_shift8 + x_shift6 - x_shift0;\n\n    // h11: 00000000000000+00-0-00+\n    wire signed [37:0] h11 = x_shift8 - x_shift5 - x_shift3 + x_shift0;\n\n    // h12: 0000000000+0+00000-000+\n    wire signed [37:0] h12 = x_shift12 + x_shift10 - x_shift4 + x_shift0;\n\n    // h13: 000000000000000+0-00-0+\n    wire signed [37:0] h13 = (_cse_0 >>> 1) + -x_shift2 + x_shift0;\n\n    // h14: 0000000000000000+0-0+0-\n    wire signed [37:0] h14 = (_cse_0 >>> 2) + (_cse_0 >>> 6);\n\n    // h15: 00000000000000-00-00+0-\n    wire signed [37:0] h15 = -x_shift8 - x_shift5 + (_cse_0 >>> 6);\n\n    // h16: 0000000000000-0-00-000-\n    wire signed [37:0] h16 = -x_shift9 - x_shift7 - x_shift4 - x_shift0;\n\n    // h17: 000000000000-00+000+00+\n    wire signed [37:0] h17 = -x_shift10 + x_shift7 + x_shift3 + x_shift0;\n\n    // h18: 000000000-000+00+00000+\n    wire signed [37:0] h18 = -x_shift13 + x_shift9 + x_shift6 + x_shift0;\n\n    // h19: 00000000000000-00+0+00-\n    wire signed [37:0] h19 = -x_shift8 + x_shift5 + x_shift3 - x_shift0;\n\n    // h20: 0000000000000-0-0-0000+\n    wire signed [37:0] h20 = -x_shift9 - x_shift7 - x_shift5 + x_shift0;\n\n    // h21: 0000000000000000-0+0-0+\n    wire signed [37:0] h21 = -x_shift6 + (_cse_0 >>> 4) + x_shift0;\n\n    // h22: 00000000000-0000+000-0-\n    wire signed [37:0] h22 = -x_shift11 + x_shift6 - x_shift2 - x_shift0;\n\n    // h23: 00000000+0000000-0+000+\n    wire signed [37:0] h23 = x_shift14 - x_shift6 + x_shift4 + x_shift0;\n\n    // h24: 000000000000+0+0000+00-\n    wire signed [37:0] h24 = x_shift10 + x_shift8 + x_shift3 - x_shift0;\n\n    // h25: 00000000000000+00-0-00+\n    wire signed [37:0] h25 = x_shift8 - x_shift5 - x_shift3 + x_shift0;\n\n    // h26: 00000000000000+00-0+00+\n    wire signed [37:0] h26 = x_shift8 - x_shift5 + x_shift3 + x_shift0;\n\n    // h27: 000000000000000+00-0-0+\n    wire signed [37:0] h27 = x_shift7 - x_shift4 - x_shift2 + x_shift0;\n\n    // h28: 0000000000000000+0-0-0+\n    wire signed [37:0] h28 = (_cse_0 >>> 2) + -x_shift2 + x_shift0;\n\n    // h29: 00000000000+00000+0+00-\n    wire signed [37:0] h29 = x_shift11 + x_shift5 + x_shift3 - x_shift0;\n\n    // h30: 0000000000000000+0+0+0-\n    wire signed [37:0] h30 = x_shift6 + x_shift4 + (_cse_0 >>> 6);\n\n    // h31: 000000000000000+0-0+00+\n    wire signed [37:0] h31 = (_cse_0 >>> 1) + x_shift3 + x_shift0;\nendmodule\n"
}